{"$schema":"https://json-schema.org/draft/2020-12/schema","$id":"urn:shinra-bansho-kan:schemas:result:1.0.0","title":"森羅万象鑑 鑑定結果","type":"object","required":["schemaVersion","subject","meta","systems","crossAnalysis","summary"],"properties":{"schemaVersion":{"type":"string"},"subject":{"type":"object"},"meta":{"type":"object"},"baseInfo":{"type":"object"},"systems":{"type":"array","items":{"type":"object","required":["id"],"properties":{"id":{"type":"string"},"name":{"type":"string"},"status":{"type":"string"},"inputsUsed":{"type":"array","items":{"type":"string"}},"calculations":{"type":"array"},"facts":{"type":"array"},"interpretation":{"type":"array"},"uncertainties":{"type":"array","items":{"type":"string"}},"sources":{"type":"array"}},"additionalProperties":true}},"crossAnalysis":{"type":"object","properties":{"strongThemes":{"type":"array"},"moderateThemes":{"type":"array"},"contradictions":{"type":"array"},"dependencyWarnings":{"type":"array"}}},"domainProfiles":{"type":"object"},"summary":{"oneOf":[{"type":"string"},{"type":"object"}]},"limitations":{"oneOf":[{"type":"array"},{"type":"object"}]},"assets":{"type":"object"}},"additionalProperties":true}
