{"schemaVersion":"1.0.0","subject":{"name":"葵 はる","birthDate":"1998-06-21"},"meta":{"createdAt":"2026-09-24","title":"星と数が示す、あなたの輪郭"},"baseInfo":{},"systems":[{"id":"western_astrology","name":"西洋占星術","status":"partial","inputsUsed":["生年月日"],"calculations":["出生時刻と場所がないため月・ASC・ハウスの特定は保留します。"],"facts":["太陽：双子座／蟹座境界付近"],"interpretation":["好奇心で世界を広げながら、身近な人や居場所を丁寧に守る力が育ちやすい象徴です。"],"uncertainties":["出生時刻・場所が不明のため、天体位置とハウスの解釈は限定的です。"],"sources":[]}],"crossAnalysis":{"strongThemes":["好奇心と共感を行き来する柔軟さ"],"moderateThemes":["学びを他者へ返す姿勢"],"contradictions":["身軽さと安心できる居場所を守る気持ちが共存します。"],"dependencyWarnings":["複数の占術は同じ生年月日情報に依存します。"]},"domainProfiles":{"work":"新しい情報を集め、異なる立場をつなぐ役割に適性を感じやすいでしょう。"},"summary":{"headline":"知性といたわりで、世界をつなぐ人","text":"異なる視点を結び直し、周囲に安心できる意味を渡していく資質が見られます。"},"limitations":["この鑑定は象徴的な読みであり、確定的な予測や診断ではありません。"],"assets":{}}
